{
  "schemaVersion": 1,
  "auditor": "K-R01-desktop-dependency-audit",
  "generatedAt": "2026-10-03T09:11:06.661Z",
  "gitHead": "54e5181e9bfeb08fa1188334ff038d710ecdd7e0",
  "root": ".",
  "scope": {
    "includeRoots": [
      {
        "id": "kernel",
        "prefix": "src",
        "migrationSurface": "target",
        "present": true,
        "note": "手机内核迁移目标面"
      },
      {
        "id": "demo-server",
        "prefix": "apps/demo/server",
        "migrationSurface": "reference",
        "present": true,
        "note": "电脑侧宿主，迁移参考面（不进手机）"
      },
      {
        "id": "mobile-kernel",
        "prefix": "apps/mobile-kernel",
        "migrationSurface": "target",
        "present": true,
        "note": "K 线手机内核（若存在）"
      },
      {
        "id": "mobile-ui",
        "prefix": "apps/mobile-ui",
        "migrationSurface": "target",
        "present": true,
        "note": "前端线手机 UI（若存在）"
      },
      {
        "id": "mobile-plugins",
        "prefix": "src/mobile-plugins",
        "migrationSurface": "target",
        "present": true,
        "note": "手机插件（若存在）"
      },
      {
        "id": "android-app",
        "prefix": "apps/android",
        "migrationSurface": "target",
        "present": true,
        "note": "安卓 App 壳（真机侧）"
      }
    ],
    "excludeDirs": [
      ".claude",
      ".dev-evidence",
      ".git",
      ".gradle",
      ".pnpm-store",
      ".runtime",
      ".task-manifest",
      "__pycache__",
      "build",
      "coverage",
      "dist",
      "docs",
      "node_modules",
      "tests"
    ],
    "excludeFilePatterns": [
      "*.test.ts",
      "*.spec.ts",
      "非代码扩展名",
      "二进制（正文含 NUL）"
    ],
    "filesScanned": 902,
    "filesBySurface": {
      "android-app": 23,
      "demo-server": 44,
      "mobile-kernel": 74,
      "mobile-ui": 83,
      "kernel": 547,
      "mobile-plugins": 131
    },
    "filesByMigrationSurface": {
      "target": 858,
      "reference": 44
    },
    "testFilesExcluded": 417,
    "skippedBinary": [
      {
        "rel": "apps/mobile-ui/src/groups/commands.ts",
        "reason": "binary (NUL byte in first 8 KiB)"
      },
      {
        "rel": "src/adapters/research/__fixtures__/real-flate-3p.pdf",
        "reason": "binary extension .pdf（未扫正文）"
      },
      {
        "rel": "src/adapters/research/__fixtures__/real-word16.docx",
        "reason": "binary extension .docx（未扫正文）"
      }
    ]
  },
  "rules": [
    {
      "id": "R1",
      "title": "裸 NUL / 不可见控制字符 / BOM",
      "why": "裸 NUL 与控制字符会让源码在手机端解包/编译时被截断或产生不可见差异；BOM 与零宽字符会造成「同内容不同字节」，破坏逐字节校验与补丁合并。",
      "source": "总方案 §8（「源码新增 NUL/编码 … 应纳入手机包检查」）",
      "count": 10,
      "byContext": {
        "comment": 6,
        "product": 4
      },
      "bySeverity": {
        "info": 6,
        "medium": 3,
        "high": 1
      }
    },
    {
      "id": "R2",
      "title": "硬编码电脑地址（回环 / 私网 / 通配绑定）",
      "why": "手机上没有「本机 127.0.0.1 的同级 Node 服务」这回事（数字员工场景例外：美团团购核销等直连本机服务另议）。产品运行路径若写死回环或私网地址，装机即不可达；0.0.0.0 更会把服务暴露到局域网。",
      "source": "总方案 §8；K-R01「无电脑静态依赖/网络路径审计」",
      "count": 43,
      "byContext": {
        "comment": 13,
        "bind-or-default": 6,
        "product": 14,
        "test": 9,
        "endpoint-constant": 1
      },
      "bySeverity": {
        "info": 31,
        "medium": 12
      }
    },
    {
      "id": "R3",
      "title": "桌面绝对路径字面量（Windows 盘符 / UNC / 家目录 / file URL）",
      "why": "C:\\ / D:\\ / \\\\?\\ / /Users/ / /home/ 在安卓上不存在对应挂载点；写死即路径解析失败。",
      "source": "总方案 §8；K-R01「无电脑静态依赖/网络路径审计」",
      "count": 14,
      "byContext": {
        "comment": 13,
        "product": 1
      },
      "bySeverity": {
        "info": 14
      }
    },
    {
      "id": "R4",
      "title": "Node 桌面专属依赖（node:fs / node:child_process / node:path / Buffer 等）",
      "why": "手机运行时不保证有 Node 内建模块与 Buffer 全局；fs 语义（同步 IO、路径分隔符、权限）也与安卓分区/SELinux 不一致。tier1 = 任务书 §8 点名的四项；tier2 = 同类 Node 内建（观察项，供迁移评估）。",
      "source": "总方案 §8；K-R01 规则 4",
      "count": 306,
      "byContext": {
        "product": 275,
        "test": 17,
        "comment": 14
      },
      "bySeverity": {
        "medium": 205,
        "info": 15,
        "high": 86
      }
    },
    {
      "id": "R5",
      "title": "疑似密钥 / 私密值字面量",
      "why": "密钥若以字面量进入手机包，等于随 APK 分发；且一旦入库即无法回收。密钥应走手机侧密钥存储，不入源码。",
      "source": "总方案 §8；CLAUDE.md 规则 0（「密钥存储…在手机」）；.gitignore「密钥不进入代码仓库」",
      "count": 5,
      "byContext": {
        "comment": 5
      },
      "bySeverity": {
        "info": 5
      }
    }
  ],
  "summary": {
    "totalHits": 378,
    "byRule": {
      "R1": 10,
      "R2": 43,
      "R3": 14,
      "R4": 306,
      "R5": 5
    },
    "bySeverity": {
      "info": 71,
      "medium": 220,
      "high": 87
    },
    "bySurface": {
      "android-app": 10,
      "demo-server": 225,
      "mobile-kernel": 18,
      "mobile-ui": 4,
      "kernel": 99,
      "mobile-plugins": 22
    },
    "r4ByModule": {
      "crypto": 22,
      "http": 27,
      "Buffer": 227,
      "fs": 10,
      "path": 11,
      "zlib": 3,
      "net": 4,
      "os": 2
    },
    "blockers": {
      "hard": 3,
      "conditional": 84
    },
    "maxHitsPerRulePerFile": 200
  },
  "hits": [
    {
      "path": "apps/android/app/src/main/AndroidManifest.xml",
      "migrationSurface": "target",
      "rule": "R2",
      "subtype": "loopback-ipv4",
      "line": 4,
      "column": 16,
      "text": "127.0.0.1",
      "severity": "info",
      "context": "comment",
      "snippet": "<!-- 只访问本机 127.0.0.1:8765 的 Node 服务，仍需 INTERNET 权限。 -->",
      "exceptionId": "EX-A1",
      "exceptionReason": "荣耀真机开发期经 `adb reverse` 走本机回环（127.0.0.1:8765）；源码注释已明确标注「那只是开发便利」，并配有严格判定（scheme/http + host/127.0.0.1 + port/8765）。属真机侧开发便利，非产品依赖 LAN 地址。",
      "blockerClass": null,
      "surface": "android-app",
      "isTestFile": false
    },
    {
      "path": "apps/android/app/src/main/java/com/potbot/demo/MainActivity.java",
      "migrationSurface": "target",
      "rule": "R2",
      "subtype": "loopback-ipv4",
      "line": 50,
      "column": 34,
      "text": "127.0.0.1",
      "severity": "info",
      "context": "comment",
      "snippet": "*    （开发默认 {@link #ORIGIN} = 本机 127.0.0.1:8765，需 adb reverse；**那只是开发便利**，",
      "exceptionId": "EX-A1",
      "exceptionReason": "荣耀真机开发期经 `adb reverse` 走本机回环（127.0.0.1:8765）；源码注释已明确标注「那只是开发便利」，并配有严格判定（scheme/http + host/127.0.0.1 + port/8765）。属真机侧开发便利，非产品依赖 LAN 地址。",
      "blockerClass": null,
      "surface": "android-app",
      "isTestFile": false
    },
    {
      "path": "apps/android/app/src/main/java/com/potbot/demo/MainActivity.java",
      "migrationSurface": "target",
      "rule": "R2",
      "subtype": "loopback-ipv4",
      "line": 87,
      "column": 41,
      "text": "127.0.0.1",
      "severity": "info",
      "context": "bind-or-default",
      "snippet": "private static final String HOST = \"127.0.0.1\";",
      "exceptionId": "EX-A1",
      "exceptionReason": "荣耀真机开发期经 `adb reverse` 走本机回环（127.0.0.1:8765）；源码注释已明确标注「那只是开发便利」，并配有严格判定（scheme/http + host/127.0.0.1 + port/8765）。属真机侧开发便利，非产品依赖 LAN 地址。",
      "blockerClass": null,
      "surface": "android-app",
      "isTestFile": false
    },
    {
      "path": "apps/android/app/src/main/java/com/potbot/demo/MainActivity.java",
      "migrationSurface": "target",
      "rule": "R2",
      "subtype": "loopback-ipv4",
      "line": 631,
      "column": 39,
      "text": "127.0.0.1",
      "severity": "info",
      "context": "comment",
      "snippet": "* 开发默认地址的严格判定：scheme/http + host/127.0.0.1 + port/8765，其它一律不算。",
      "exceptionId": "EX-A1",
      "exceptionReason": "荣耀真机开发期经 `adb reverse` 走本机回环（127.0.0.1:8765）；源码注释已明确标注「那只是开发便利」，并配有严格判定（scheme/http + host/127.0.0.1 + port/8765）。属真机侧开发便利，非产品依赖 LAN 地址。",
      "blockerClass": null,
      "surface": "android-app",
      "isTestFile": false
    },
    {
      "path": "apps/android/app/src/main/java/com/potbot/demo/PotbotEndpoints.java",
      "migrationSurface": "target",
      "rule": "R2",
      "subtype": "loopback-ipv4",
      "line": 13,
      "column": 36,
      "text": "127.0.0.1",
      "severity": "info",
      "context": "comment",
      "snippet": "* 现状（历史）：宿主把服务地址写死成 {@code http://127.0.0.1:8765}，而该端口要靠",
      "exceptionId": "EX-A1",
      "exceptionReason": "荣耀真机开发期经 `adb reverse` 走本机回环（127.0.0.1:8765）；源码注释已明确标注「那只是开发便利」，并配有严格判定（scheme/http + host/127.0.0.1 + port/8765）。属真机侧开发便利，非产品依赖 LAN 地址。",
      "blockerClass": null,
      "surface": "android-app",
      "isTestFile": false
    },
    {
      "path": "apps/android/app/src/main/java/com/potbot/demo/PotbotEndpoints.java",
      "migrationSurface": "target",
      "rule": "R2",
      "subtype": "loopback-ipv4",
      "line": 48,
      "column": 59,
      "text": "127.0.0.1",
      "severity": "info",
      "context": "product",
      "snippet": "public static final String DEV_USB_BASE_URL = \"http://127.0.0.1:8765\";",
      "exceptionId": "EX-A1",
      "exceptionReason": "荣耀真机开发期经 `adb reverse` 走本机回环（127.0.0.1:8765）；源码注释已明确标注「那只是开发便利」，并配有严格判定（scheme/http + host/127.0.0.1 + port/8765）。属真机侧开发便利，非产品依赖 LAN 地址。",
      "blockerClass": null,
      "surface": "android-app",
      "isTestFile": false
    },
    {
      "path": "apps/android/app/src/main/java/com/potbot/demo/PotbotEndpoints.java",
      "migrationSurface": "target",
      "rule": "R2",
      "subtype": "loopback-ipv4",
      "line": 170,
      "column": 17,
      "text": "127.0.0.1",
      "severity": "info",
      "context": "bind-or-default",
      "snippet": "return \"127.0.0.1\".equals(host) || \"localhost\".equals(host) || \"::1\".equals(host);",
      "exceptionId": "EX-A1",
      "exceptionReason": "荣耀真机开发期经 `adb reverse` 走本机回环（127.0.0.1:8765）；源码注释已明确标注「那只是开发便利」，并配有严格判定（scheme/http + host/127.0.0.1 + port/8765）。属真机侧开发便利，非产品依赖 LAN 地址。",
      "blockerClass": null,
      "surface": "android-app",
      "isTestFile": false
    },
    {
      "path": "apps/android/app/src/main/java/com/potbot/demo/PotbotEndpoints.java",